Name,Price,Description,Reviews,Rating,Image URL
"ASIAN Men's CAPTAIN-13 Sports Running,Walking & Gym Shoes with Lightweight Eva Sole with Casual Sneaker Shoes for Men's & Boy's",₹579,"['Lightweight & Breathable : Exclusive design and durable materials every step feels light and breezy. Breathable, free-moving fabrics which adjust according to your foot and creates an astoundingly easy-going experience.', 'Non Slip & Shockproof : Great engineering strikes a balance in style, made in the potent design and latest fashion trends. Made for long-term wear, with extra emphasis on providing cushion to the feet, removing heel strain.', 'Comfort Sole & Flexible Walk : The outsoles are made by an air cushion, doubling the effect of shock absorption. Besides, these shoes perform excellent in durability and are also slip resistant. It provides push cushioning comfort for foot pain relief and helps relieve pressure while conforming to your every step']","3,044 ratings",3.7 out of 5 stars,https://m.media-amazon.com/images/I/412mlBTMqlL._SY395_SX395_.jpg
Woodland Mens G 40777cma Sneaker,"₹1,939","['This product is handmade, and may have slight differences in stitching compared to the image']","7,215 ratings",4.1 out of 5 stars,https://m.media-amazon.com/images/I/41BvzKoWu-L._SX395_SY395_.jpg
Reebok Mens Comfort Infused Running Shoe,"₹2,359",['Synthetic'],"1,318 ratings",3.9 out of 5 stars,https://m.media-amazon.com/images/I/4109z4YVUrL._SY395_SX395_.jpg
Bata Mens Boss-sail EUniform Dress Shoe,₹775,"['Comfortable and light', 'Color Black', 'Outer Material Synthetic', 'Heel Height 2', 'Clean With dry cloth']",13 ratings,3.8 out of 5 stars,https://m.media-amazon.com/images/I/310pKX4VW1L._SX395_SY395_.jpg
Adidas Mens Run Steady M Running Shoe,"₹2,879","['Upper Material-Mesh', 'Fastening-Lace up', 'Outsole Type-Marking', 'Ankle Height-Low', 'Arch Type-Medium']","1,072 ratings",4.0 out of 5 stars,https://m.media-amazon.com/images/I/41O7Xor+MZL._SX395_SY395_.jpg
Campus Men's MAXICO Running Shoes,₹699,"['Material Type: Mesh', 'Lifestyle: Sports', 'Warranty Type: Manufacturer', 'Care Instructions: Allow your pair of shoes to air and de-odorize at a regular basis, this also helps them retain their natural shape; use shoe bags to prevent any stains or mildew; dust any dry dirt from the surface using a clean cloth, do not use polish or shiner']","26,475 ratings",3.9 out of 5 stars,https://m.media-amazon.com/images/I/41pMjO0TF2L._SY395_SX395_.jpg
Adidas Mens Fluidglow M Sneaker,"₹1,919",['Upper Material: Pu and Textile; Outer Sole: Rubber ;Color: Stone/ftwwht/acimin/d ;Closure: Slip-on; Ankle Height: Regular ;Cushioning: Medium; Insole: Padded ;Package Contents: Pair of Running Shoes'],"2,000 ratings",3.9 out of 5 stars,https://m.media-amazon.com/images/I/41P5bYBG1NL._SX395_SY395_.jpg
"JQR SPECIAL-001 Shoes for Men, Sports Shoes for Men, Running Shoes for Men, Men Shoes, Sports Shoes, Walking Shoes for Men, Sport Shoes for Men, Gym Shoes for Men",₹749,"['Outer Material:Mesh', 'Ankle Length:Low']",311 ratings,4.5 out of 5 stars,https://m.media-amazon.com/images/I/41hQf9clkeL._SY395_SX395_.jpg
Adidas Mens Rayrun M Running Shoe,"₹2,439","['Upper Material-Synthetic', 'Outersole material-Rubber', 'Ankle Height-Low', 'Arch Type-Medium']",165 ratings,4.3 out of 5 stars,https://m.media-amazon.com/images/I/41iQ2h+RGXL._SY395_SX395_.jpg
Amazon Brand - Jam & Honey Unisex-Child PegasusSneaker,₹524.,"['Kids Knit shoe', 'Soft Eva Out sole', 'Soft Coushioned insole', 'Fit Type: Regular', 'Slip on shoe']",3 ratings,3.3 out of 5 stars,https://m.media-amazon.com/images/I/51dx58C6jqL._SX395_SY395_.jpg
Campus Men's BROKLYN Walking Shoes,₹849,"['Material Type: Mesh', 'Lifestyle: Sports', 'Warranty Type: Manufacturer', 'Care Instructions: Allow your pair of shoes to air and de-odorize at a regular basis, this also helps them retain their natural shape; use shoe bags to prevent any stains or mildew; dust any dry dirt from the surface using a clean cloth, do not use polish or shiner']","1,107 ratings",3.9 out of 5 stars,https://m.media-amazon.com/images/I/31sIU5TTVvL._SY395_SX395_.jpg
Kraasa mens Spo7204-darkblack Walking Shoes,₹499,"['Feature : Extremely comfortable material , shoes for everyday use, or zym .This unique design and stylish shoes is to maximize your fashion at the fairest price possible. Lifestyle: Sports']",9 ratings,3.8 out of 5 stars,https://m.media-amazon.com/images/I/31xlww1ouSL._SY395_SX395_.jpg
Campus Men's ROC PRO Training/Gym Shoes,₹949,"['Upper-Embrace the ultimate comfort with a breathable mesh upper that lets your feet breathe freely. The lace-up closure ensures a snug fit, making these shoes perfect for college, office days, or even casual dates.', 'Anti-Skid Outsole Design-The innovative Anti-Skid Outsole design enhances your natural movement, making every step smooth and secure. Say goodbye to slipping and hello to confident strides.', ""Memory Foam Comfort-Immerse your feet in luxury with the Memory Foam insole that shapes your foot's contours. Experience a customized fit and the cushioned base that transforms walking into a delightful experience."", 'Versatile Styling: From sporty to casual, these shoes seamlessly complement your style. Pair them with jeans or joggers for a laid-back look, or dress them up with chinos for a smart-casual ensemble.', 'Easy Care Tips: Keeping these shoes fresh is simple. Gently wipe off dirt with a damp cloth and let them air dry away from direct heat. Regular care maintains its vibrant appeal.']","1,940 ratings",4.0 out of 5 stars,https://m.media-amazon.com/images/I/41ChJYTt3rL._SX395_SY395_.jpg
Bacca Bucci Essential Your Everyday All Purpose Walking Running Casual Shoes for Men,"₹1,099","['Total Comfort for Everyday Use:\xa0Extra padding at the tongue and collar helps keep your feet feeling comfortable. We also placed engineered mesh—which is stronger and more flexible than regular mesh—throughout the top for lightweight breathability.', 'Supportive Steps:\xa0Impactwire technology is integrated with a midfoot band for total support that helps keep your feet in place.', 'Snap, Run, and Pop:\xa0This Shoe is more Lightweight than our predecessor, with durable foam that delivers a smooth, responsive ride. We paired it with an outsole unit at the forefoot and the heel for an energized feel.', ""Smooth Transitions:\xa0The heel shape is designed to optimize landing, helping you easily transition from heel to toe. We've paired it with thick foam for a responsive ride."", 'More Benefits:\xa0The tongue is separated from the upper to give room for different foot shapes. The waffle-inspired outsole gives you excellent traction. Grooves on the rubber sole allow for natural motion.']",68 ratings,4.1 out of 5 stars,https://m.media-amazon.com/images/I/41yBAo-FrhL._SY395_SX395_.jpg
Bacca Bucci Project Plus Running/Walking/Training Shoe Specially Developed for Wide and Large Foots | Only Big UK-11 to 15,"₹1,399","['High-abrasion rubber Out Sole : High-abrasion rubber Out Sole provides long-lasting durability and adequate grip and Bouce with every Step.', 'Molded EVA sockliner : Double density EVA Sockliner Provides comfort on every step, it reduces your foot fatigue.', 'Compression-molded foam midsole : Compression-Moulded foam midsole with a lower heel-to-toe drop provides lightweight and propulsive power.', 'Stretchy, recycled content mesh : Open-engineered Stretchy mesh offers enhanced breathability and comfort.', 'Your Everyday Shoe : you can use these Bacca Bucci Sports Shoes for your everyday Run,walk or just pair up with any outfit, it gives both style and comfort.']",56 ratings,4.1 out of 5 stars,https://m.media-amazon.com/images/I/41d4Jd3w72L._SY395_SX395_.jpg
Bacca Bucci® Men's Power Trainer Running Shoes Lightweight Shockproof Walking Shoes Cushioning Men Sneakers for Gym Sports Casual Athletic Outdoor-Size-UK-6 to 13/Big Black,"₹1,199","[""Cushioning MD sole: this men's running shoe uses a cushioning MD sole, its EVA secondary foaming technology, which has 30% more cushioning, it can distract 60% of the foot's pressure during running, make you feel comfortable"", 'Lightweight design: designed with a polyester lightweight vamp and the free tension allows you to enjoy the ultimate barefoot feeling, improve the overall stability and flexibility', 'Comfortable experience: it use of ergonomic design, the inside of the shoe is made of a comfortable polyester fabric, the free tension allows you to enjoy the ultimate barefoot feeling', 'Anti-slip and waterproof: made by EVA+MD outsole,17% performance better than ordinary rubber, which improves wear resistance and grip strength.it is scratch-resistant, non-slip, and effectively supports the heel', 'Available Size: UK-6 to 13']",1 rating,5.0 out of 5 stars,https://m.media-amazon.com/images/I/41Dtprf9HzL._SY395_SX395_.jpg
Bacca Bucci® Running Shoes Men Lightweight Fashion Sneakers Walking Footwear Tennis Athletic Shoes for Outdoor Sport Gym Jogging Big Size UK-11 to 15,"₹1,199","[""Knit Upper: Soft & Comfortable & Breathable. Knit Upper Material Make It Possible That Your Feet Free Breath When You Run Or Walk. It'S Soft And Protective To Cushion Your Every Step."", 'Md Sole: Lightweight & Excellent Bounce-Back & Durability. The Soft Sole Is Made From Durable And High Elastic Md Outsole, Slip Resistant,Easy To Manage Any Area.', 'Fashion Design: Perfect Accord With Human Body Engineering, Green, Healthy Concept Design. Selection Of Good Material, Breathable, Lightweight, Comfortable Shoes. Fashion Unique Durable, Safe Environmental Protection Material.', 'Suitable For: Walking, Daily Walking, Casual, Outdoor, Vacation, Party, Sports, Yoga, Golf, Gym, Driving, Shopping, Work And Etc.; Attention: Please Confirm The Size Chart, Choose Your Usual Size When Placing Order. Size Is The Standard Sports Shoes Size. Contact Us When You Have Any Problem Before Or After Buying Our Product, We Are Always Here For You.', 'Age Range Description: Adult']",282 ratings,4.1 out of 5 stars,https://m.media-amazon.com/images/I/41V9lZdH9QL._SY395_SX395_.jpg
"Bacca Bucci mens Men Running Shoes , Grey, 9 UK","₹2,198","['Unparalleled Performance: Experience the epitome of performance with the Bacca Bucci HYPERSOFT SERIES, designed to enhance your running experience with exceptional responsiveness and energy return.', 'Lightweight and Supportive Fit: The iconic breathable engineered knit upper provides a lightweight and supportive fit, allowing for optimum airflow and keeping your feet cool and dry during intense runs.', 'Enhanced Breathability and Flexibility: Enjoy enhanced breathability and flexibility with the HYPERSOFT SERIES, enabling you to move with fluidity and ease, giving you an edge during your runs.', 'Cutting-Edge Technology and Sleek Aesthetics: These shoes are crafted with meticulous attention to detail, combining cutting-edge technology with sleek aesthetics, offering a perfect blend of style and functionality.', ""Trusted Companion for Running Goals: Whether you're engaging in intense sprints or embarking on long-distance runs, the Bacca Bucci HYPERSOFT SERIES running shoes are your trusted companion on your journey to achieving your running goals. Step into a world of comfort, durability, and unparalleled performance.""]",1 rating,5.0 out of 5 stars,https://m.media-amazon.com/images/I/51gJt7q6RTL._SX342_SY445_.jpg
