Name,Price,Description,Reviews,Rating,Image URL
Campus Men's MAXICO Running Shoes,₹699,"['Material Type: Mesh', 'Lifestyle: Sports', 'Warranty Type: Manufacturer', 'Care Instructions: Allow your pair of shoes to air and de-odorize at a regular basis, this also helps them retain their natural shape; use shoe bags to prevent any stains or mildew; dust any dry dirt from the surface using a clean cloth, do not use polish or shiner']","26,475 ratings",3.9 out of 5 stars,https://m.media-amazon.com/images/I/41pMjO0TF2L._SY395_SX395_.jpg
Campus Mens Ignite ProRunning Shoes,₹713,"['Lifestyle: Running Shoes', 'Warranty Type: Manufacturer', 'Care Instructions: Allow your pair of shoes to air and de-odorize at a regular basis, this also helps them retain their natural shape; use shoes bags to prevent any stains or mildew; dust any dry dirt from the surface using a clean cloth, do not use polish or shiner']","4,196 ratings",3.9 out of 5 stars,https://m.media-amazon.com/images/I/41Pf0DSbjDL._SX395_SY395_.jpg
Campus Mens 5g-845 Running Shoe,"₹1,104","[""Shoes' Upper- Get ready to slay every day in these men's sports shoes with a supportive design and a soothing knitted vamp that feels super soft on your skin. The lace-up closure ensures a perfect fit, keeping your feet secure. Whether you are off to work, college, a pleasure trip, or a day out, these shoes for men adapt flawlessly to any occasion."", ""Shoes' Outsole- These casual men's shoes feature an Air Capsule in the midsole that delivers comfort and cushioning for your feet. You can wear them for various outdoor activities, such as running, gymming, walking, jogging, cardio, yoga, and more. The shoes have a responsive cushioning that makes them ideal for everyday use."", ""Shoes' Insole- Enjoy a comfortable and custom fit with these running shoes for men. The Memory Foam insole conforms to your foot shape and supports your feet's arch. The cushioned insole also makes walking or running more pleasant. These casual shoes have a supportive design for every step you take."", 'Style your shoes- For men who like versatile and comfortable running shoes, these lace-ups shoes are a great choice. They have a striking color scheme and an Air-Capsule in the heel for cushioning and stability. You can easily pair them with different outfits, from semi-formal to casual, depending on the occasion. Whether you are going to a party, to the park, on a coffee date, on a trip, or its just another day of college these shoes will fit your style.', ""Clean your Shoes- For optimal maintenance of these shoes, wipe off any dust from the surface with a dry cloth daily. Wash them with soap and water monthly and let them air dry. These men's shoes are easy to wash, clean, and dry.""]","2,848 ratings",3.9 out of 5 stars,https://m.media-amazon.com/images/I/41+m4NMW5VL._SX395_SY395_.jpg
Amazon Brand - Symactive Mens FanaticRunning Shoe,₹645.,"['Memory foam insole to provide more cushioning and comfort', 'EVA outsole for better flexibility & bounce during movement', 'Our wide variety of sports footwear is made keeping you in mind. Available in a plethora of colours, shapes and materials, symactive shoes have been crafted with the single-minded objective of comfort, style and longevity. All of this at a price you simple can’t say no to.', 'Item Package Weight: 600.0 grams']",806 ratings,3.8 out of 5 stars,https://m.media-amazon.com/images/I/314XhW8D6eL._SX395_SY395_.jpg
new balance,"₹2,761","['MESH', 'Rubber outsole']",202 ratings,3.6 out of 5 stars,https://m.media-amazon.com/images/I/51HNfI8qknL._SY395_SX395_.jpg
ASIAN Men's Wonder-13 Sports Running Shoes…,₹595,"['Lightweight & Breathable : Exclusive design and durable materials every step feels light and breezy. Breathable, free-moving fabrics which adjust according to your foot and creates an astoundingly easy-going experience.', 'Non Slip & Shockproof : Great engineering strikes a balance in style, made in the potent design and latest fashion trends. Made for long-term wear, with extra emphasis on providing cushion to the feet, removing heel strain.', 'Comfort Sole & Flexible Walk : The outsoles are made by an air cushion, doubling the effect of shock absorption. Besides, these shoes perform excellent in durability and are also slip resistant. It provides push cushioning comfort for foot pain relief and helps relieve pressure while conforming to your every step']","96,176 ratings",3.9 out of 5 stars,https://m.media-amazon.com/images/I/41xDwuBHfOL._SY395_SX395_.jpg
new balance Mens DriftRunning Shoe,"₹1,785.","['Engineered mesh upper', 'Forefoot comfort pad', 'Rubber outsole']",48 ratings,4.1 out of 5 stars,https://m.media-amazon.com/images/I/41hsJI0rVoL._SY395_SX395_.jpg
"JQR - Signature Shoes for Men, Sports Shoes for Men, Running Shoes for Men, Men Shoes, Sports Shoes, Walking Shoes for Men, Sport Shoes for Men, Gym Shoes for Men","₹1,349","['Outer Material:Syntectic', 'Midsole Material:TPU/EVA', 'Outsole Material:Rubber', 'Ankle Length:Low']",199 ratings,4.4 out of 5 stars,https://m.media-amazon.com/images/I/41rzdD89yXL._SY395_SX395_.jpg
Skechers Mens Bounder - Verkona Sneaker,"₹2,609",['Mesh Lace Up Jogger W/Hot Melt Overlays & Air-cool'],"1,002 ratings",4.0 out of 5 stars,https://m.media-amazon.com/images/I/31FtPl2wfFL._SY395_SX395_.jpg
"Nivia Flash 2.0 Badminton Shoes for Men, Rubber Sole with PVC Synthetic Leather Upper and mesh for Sports, Badminton, Volleyball, Squash, Table Tennis, (White) UK-10",₹949,"['Die-Cut soft NR EVA sock liner laminated with Polyester fabric.', 'Soft cushion NR EVA Inner insole.', 'Die-Cut soft NR EVA sock liner laminated with Polyester fabric.', 'PVC synthetic leather Upper with mesh.', 'TOE forepart stitching on sole lip gives provides support toe area.']",42 ratings,3.7 out of 5 stars,https://m.media-amazon.com/images/I/41yuGGvKAeL._SY395_SX395_.jpg
Adidas Mens Astoundrun MRunning Shoe,"₹1,449","['Upper Material-Synthetic', 'Outersole material-Rubber', 'Ankle Height-Low', 'Arch Type-Medium']",297 ratings,4.0 out of 5 stars,https://m.media-amazon.com/images/I/41K1nEaRrnL._SX395_SY395_.jpg
Liberty Force 10 Sports Shoes for Men,₹712,"['Material: Mesh', 'Color: Blue', 'Care Instructions: Allow your Pair of Shoes to Air and De-Odorize at a Regular Basis', 'Lifestyle: Sports Shoes']",602 ratings,3.8 out of 5 stars,https://m.media-amazon.com/images/I/31Whh+vyBLL._SY395_SX395_.jpg
Adidas Men's Clinch-X M Running Shoe,"₹1,089",['Upper: Mesh upper for lightweight and breathability ;These are Men Running Shoes ;Brand: Adidas ;Midsole: lightstrike IMEVA midsole with visible adiprene providing protection from harmful impact forces.'],"5,176 ratings",4.0 out of 5 stars,https://m.media-amazon.com/images/I/41wWvZxkW8L._SX395_SY395_.jpg
"Red Tape Casual Lifetsyle Shoes for Women | Soft Cushioned Insole, Slip-Resistance, Dynamic Feet Support, Arch Support & Shock Absorption","₹1,649","['Material: Sole - TPR (Thermoplastic Rubber) | Upper - PU (Polyurethane)', ""THIS WOMEN'S CASUAL SHOES IS FOR: Achieving fashionable comfort with these PU Uppers featuring a cushioned TPR Sole and classic Round Toe shape. Enjoy all-day style and confidence in this trendy footwear!"", 'Features: Closure - Lace-up | Heel Height - Flat | Toe Shape - Round', 'Benefits: Designed for maximum comfort and style, these shoes are perfect for everyday wear. The non-slip TPR Sole and durable PU will provide support all day long. With the gripping technologies featured on this shoe, you can stay balanced on different terrains with ease.', 'LIFESTYLE: Sneakers', 'Care Instruction : Wipe with a clean, dry cloth to remove the dust.']",2 ratings,4.5 out of 5 stars,https://m.media-amazon.com/images/I/31DLkzR5CrL._SY395_SX395_.jpg
Puma Men's Dazzler Sneakers,"₹2,456","['Style Name:- Casual Shoe', 'Model Name:- Dazzler', 'Brand Color:-PUMA Black-PUMA Silver', 'Wipe with a clean dry cloth']","5,186 ratings",4.0 out of 5 stars,https://m.media-amazon.com/images/I/31Ts3FHYdCL._SY395_SX395_.jpg
Puma Mens Ultimate EaseWalking Shoe,"₹1,652","['Style Name:-Walking Shoe', 'Model Name:-Ultimate Ease', 'Brand Color:-PUMA Black-PUMA White', 'Activity Group:-Walking', 'Care Instructions:-Wipe with a clean dry cloth']","3,310 ratings",4.0 out of 5 stars,https://m.media-amazon.com/images/I/31ndygwdRyL._SY395_SX395_.jpg
Adidas Mens Fluento M Running Shoe,"₹2,009","['Upper Material-Synthetic', 'Outersole material-Rubber', 'Ankle Height-Low', 'Arch Type-Medium']",65 ratings,4.1 out of 5 stars,https://m.media-amazon.com/images/I/41MLapkKarL._SY395_SX395_.jpg
Woodland Mens OGC 3608119Casual Shoe,"₹1,939","['This product is handmade, and may have slight differences in stitching compared to the image']","1,015 ratings",4.0 out of 5 stars,https://m.media-amazon.com/images/I/41JIKcgH60L._SX395_SY395_.jpg
Skechers Mens Delson 3.0 - Regento Sneaker,"₹2,867","['Mesh Slip On', 'DELSON 3.0']",14 ratings,3.7 out of 5 stars,https://m.media-amazon.com/images/I/41TShCZPUqL._SY395_SX395_QL70_ML2_.jpg
Nike Womens W Flex Experience Rn 11 Nn Running Shoe,"₹2,747",['W FLEX EXPERIENCE RN 11 NN-PURE PLATINUM/LT CRIMSON-WOLF GREY-DD9283-007-5UK'],390 ratings,4.3 out of 5 stars,https://m.media-amazon.com/images/I/41jWVA7HusL._SX395_SY395_.jpg
Bacca Bucci Mens Majesty sports shoes,"₹1,399","['5-In-1 Uni-Moulding Technology Shock Absorbent Durable & Slip-Resistant This Technology Will Keep The Stitching On The Shoes Intact For Long-Lasting Usage.', 'Unique Color Block Structure,The Structure Improves Balance While Offering The Needed Arch Support And Reducing The Chance Of Sprains.', 'Strong Suspension For Reduced Impact Uni-Body Suspension Balancing Patch.; Stronger Grip With Excellent Forward Momentum With A Solid Grip, You Donâ€T Have To Worry About Abrasion.', 'Heels With High-Density Sponge Lining Thick, Full And Comfortable The Bottom Of The Insole Is Constructed Using Polyurethane Foraminate Material To Aid Air Circulation. This Keeps Your Feet From Feeling Cramped Or Suffocated.', 'Age Range Description: Adult']",417 ratings,3.9 out of 5 stars,https://m.media-amazon.com/images/I/41iwBK02RuL._SY395_SX395_.jpg
Bacca Bucci Men's Running Shoe,"₹1,399","['5-In-1 Uni-Moulding Technology Shock Absorbent Durable & Slip-Resistant This Technology Will Keep The Stitching On The Shoes Intact For Long-Lasting Usage.', 'Unique Color Block Structure,The Structure Improves Balance While Offering The Needed Arch Support And Reducing The Chance Of Sprains.', 'Strong Suspension For Reduced Impact Uni-Body Suspension Balancing Patch.; Stronger Grip With Excellent Forward Momentum With A Solid Grip, You Donâ€T Have To Worry About Abrasion.', 'Heels With High-Density Sponge Lining Thick, Full And Comfortable The Bottom Of The Insole Is Constructed Using Polyurethane Foraminate Material To Aid Air Circulation. This Keeps Your Feet From Feeling Cramped Or Suffocated.; Age Range Description: Adult', 'Toe Style: Round Toe; Department Name: Mens']","3,117 ratings",3.9 out of 5 stars,https://m.media-amazon.com/images/I/410Z9J-mP6L._SY395_SX395_.jpg
Bacca Bucci Jump Men's Running Shoe with Padded Insocks for Better Traction with Phylon Bounce Sole for Running Gyming & Training,"₹1,399","['BEST USED FOR: These shoes have been specifically designed to ensure natural and comfortable road running experience. The ultimate mix of cushioning and response to keep you moving mile after mile.', 'ENSURE COMFORTABLE RUNNING EXPERIENCE: These road running shoes are built to take on your long runs, daily training and recovery runs to deliver the comfort of its predecessor.', 'MORE CUSHIONING AND RESILIENCE: Zippedfoam a midsole compound which is springier than EVA and offers more rebound over the life of the shoe.; ALL DAY COMFORT: The overlay-free engineered mesh upper made of 30% recycled materials keeps the foot cool and comfortable, with reinforced security through the midfoot.', ""ALL TIME CLASSIC STYLE:High-tops birthed the very concept of sneakers as we know them today. To show our admiration for classic high-tops, we've launched the GOAT High-Top Rebound basketball shoe."", 'Department Name: Mens; Water Resistance Level: Not Water Resistant; Toe Style: Round Toe; Age Range Description: Adult; Style Name: Walking']",241 ratings,3.5 out of 5 stars,https://m.media-amazon.com/images/I/410gS9FXI2L._SX395_SY395_.jpg
Campus Men's VAYU Walking Shoes,₹839,"[""Shoes' Upper- Step effortlessly into comfort and style with these casual slip-on shoes for men. The knitted vamp upper ensures a cool and comfortable environment for your feet. Designed for convenience, these slip-ons are a hassle-free choice, especially for those averse to tying laces. From college and office settings to casual dates, they cater to a range of needs. Versatile and adaptable, these casual men's shoes are well-suited for any occasion."", ""Shoes' Outsole- Benefit from the cushioned support of the Pillo Foam sole, which guarantees a soft landing with each step you take. Relish in the secure impact protection provided by the outsole, ensuring comfortable striding. These men's shoes seamlessly align with your dynamic, fast-paced lifestyle, making them an impeccable choice for those who are always on the move."", ""Shoes' Insole- Experience advanced comfort with these men's casual shoes boasting a Memory Foam insole that conforms to your foot's contours and offers superior arch support. Enjoy personalized comfort while walking or running, thanks to the cushioned insole. These shoes for men are thoughtfully designed to amplify support throughout your stride, making each step more comfortable and supported."", 'Styling Tips- Match slip-ons with rolled-up jeans and a simple tee for a laid-back and comfortable ensemble. Or try these slip-on with shorts and a lightweight button-up shirt for a stylish summer outfit.', 'Clean Your Shoes- To keep these casual shoes in good condition just remove any dust from the surface with a dry cloth every day. Second, wash these running shoes with soap water once a month and let them air dry. These shoes are washable and easy to clean and dry.']",529 ratings,3.9 out of 5 stars,https://m.media-amazon.com/images/I/31NQIFE31fL._SY395_SX395_.jpg
US Polo Association Mens Abor Sneakers,"₹1,903",[],"4,106 ratings",3.6 out of 5 stars,https://m.media-amazon.com/images/I/31uHlnPUGML._SY395_SX395_.jpg
Skechers Mens Go Run ConsistentRunning Shoe,"₹4,069","['ULTRA LIGHT FOAM, M-STRIKE TECHNOLOGY, AIR COOLED GOGA MAT INSOLE']",10 ratings,3.7 out of 5 stars,https://m.media-amazon.com/images/I/316nep+xHIL._SX395_SY395_.jpg
Bacca Bucci Proton Men's Plus Size Sports Shoes with Shock Absorption Sports Lining & Anti-Slip Whole-Woven Upper,"₹1,589","['Breathable and Comfortable: Whole-Woven Double-layer structure is used to shape the lightweight upper, which enhances air circulation and creates a cool and dry wearing environment.', 'Stable and Durable: The side upper of the Running shoe is made of Nylon Superior Textile material, which wraps the foot in all directions, provides excellent stability and support, and prevents the feet from sliding in the shoe during exercise.', 'Elastic Insole: The memory foam insole perfectly fits the skin of the foot and provides a soft touch. It can fully absorb vibration, reduce foot pressure, and provide all-day comfort.', 'Cushion and Support: The foam midsole can effectively slow down the vibration during exercise, buffer the impact of the ground on the foot, and rebound quickly, giving the foot strong support.', 'Upgraded Outsole: Outsole combines MD and rubber which greatly enhances elasticity and abrasion resistance. The sole of the shoe has a snake scales pattern, offering durable traction on a variety of surfaces.']",187 ratings,4.1 out of 5 stars,https://m.media-amazon.com/images/I/41XRAexCc1L._SY395_SX395_.jpg
Bacca Bucci® Running Shoes Men Lightweight Fashion Sneakers Walking Footwear Tennis Athletic Shoes for Outdoor Sport Gym Jogging Big Size UK-11 to 15,"₹1,199","[""Knit Upper: Soft & Comfortable & Breathable. Knit Upper Material Make It Possible That Your Feet Free Breath When You Run Or Walk. It'S Soft And Protective To Cushion Your Every Step."", 'Md Sole: Lightweight & Excellent Bounce-Back & Durability. The Soft Sole Is Made From Durable And High Elastic Md Outsole, Slip Resistant,Easy To Manage Any Area.', 'Fashion Design: Perfect Accord With Human Body Engineering, Green, Healthy Concept Design. Selection Of Good Material, Breathable, Lightweight, Comfortable Shoes. Fashion Unique Durable, Safe Environmental Protection Material.', 'Suitable For: Walking, Daily Walking, Casual, Outdoor, Vacation, Party, Sports, Yoga, Golf, Gym, Driving, Shopping, Work And Etc.; Attention: Please Confirm The Size Chart, Choose Your Usual Size When Placing Order. Size Is The Standard Sports Shoes Size. Contact Us When You Have Any Problem Before Or After Buying Our Product, We Are Always Here For You.', 'Age Range Description: Adult']",282 ratings,4.1 out of 5 stars,https://m.media-amazon.com/images/I/41V9lZdH9QL._SY395_SX395_.jpg
Bacca Bucci® Men's Running Shoes Light-Weight Shockproof Walking Shoes Cushioning Sneakers for Gym Sports Casual Athletic Outdoor,"₹1,299","['?CUSHIONING MD SOLE:This mens running shoe uses a cushioning MD sole, it’s EVA secondary foaming technology, which has 30% more cushioning,it can distract 60% of the foot‘s pressure during running,make you feel comfortable.', '?LIGHTWEIGHT DESIGN:Designed with polyester lightweight vamp, and the free tension allows you to enjoy the ultimate barefoot feeling,improve the overall stability and flexibility.', '?COMFORTABLE EXPERIENCE:It use of ergonomic design,the inside of the shoe is made of a comfortable polyester fabric,the free tension allows you to enjoy the ultimate barefoot feeling.', '?ANTI-SLIP AND WEARPROOF:Made by EVA +MD outsole,17% performance better than ordinary rubber, which improves wear resistance and grip strength.It is scratch-resistant, non-slip, and effectively supports the heel.', '?BACCA BUCCI GUARANTEE: If have any problems with with the quality of our mens sneakers, we will 100% refund. Please without any hesitations to contact us, we will handle it within 24 hours.']",362 ratings,4.2 out of 5 stars,https://m.media-amazon.com/images/I/41ximszHgvL._SY395_SX395_.jpg
Bacca Bucci Project Plus Running Walking Training Gym Shoes Specially Developed for Wide and Large Foots | Only Big UK-11 to 15,"₹1,299","['Easy to maintain', 'CUSHIONING MD SOLE:This mens running shoe uses a cushioning MD sole, it s EVA secondary foaming technology, which has 30% more cushioning,it can distract 60% of the foot s pressure during running,make you feel comfortable.']",563 ratings,4.1 out of 5 stars,https://m.media-amazon.com/images/I/51+YhwnWMNL._SY395_SX395_.jpg
Bacca Bucci® Men's Running Shoes Light Weight Shock Proof Walking Shoes Cushioning Sneakers Gym Sports Casual Athletic Outdoor,"₹1,299","['?CUSHIONING MD SOLE:This mens running shoe uses a cushioning MD sole, it s EVA secondary foaming technology, which has 30% more cushioning,it can distract 60% of the foot s pressure during running,make you feel comfortable.']",140 ratings,4.1 out of 5 stars,https://m.media-amazon.com/images/I/41F2FskNA7L._SY395_SX395_.jpg
Woodland Mens Gc 1868115nw Sneaker,"₹3,037",['Casual Leather Shoes'],633 ratings,4.0 out of 5 stars,https://m.media-amazon.com/images/I/41BN8pUQwUL._SX395_SY395_.jpg
U.S. POLO ASSN. Mens RubenSneaker,"₹2,849","['us polo mens sneakar', 'U.S. Polo Assn. Men RUBEN SNEAKERS']",6 ratings,2.9 out of 5 stars,https://m.media-amazon.com/images/I/41K29pq3t6L._SY395_SX395_.jpg
ASICS Men's Gel-Contend 4B+ Running Shoes,"₹1,999","['Breathable Upper to provide cooling comfort', 'Superior Cushioning and Flexibility', 'Upper Material - Synthetic Fiber']","4,250 ratings",4.0 out of 5 stars,https://m.media-amazon.com/images/I/31wbQh2CBXL._SY395_SX395_.jpg
Reebok Mens Speed Runner Lp Running Shoe,"₹1,203","['Outer Material: Synthetic', 'Closure Type: Lace-Up', 'Toe Style: Round Toe', 'Warranty Type: Manufacturer & Seller', 'Warranty Description: 90 days']","1,375 ratings",4.0 out of 5 stars,https://m.media-amazon.com/images/I/41LXk-HDt7L._SX395_SY395_.jpg
ASICS Men's Gel-Courtmov Indoor Sports Shoes,"₹3,830","['Multi-purpose indoor court shoe that offers good stability and easy movement for a range of court athletes.', 'Provides better stability during game', 'Upper Material - Synthetic Leather']",312 ratings,3.9 out of 5 stars,https://m.media-amazon.com/images/I/41y+X2+cc3L._SX395_SY395_.jpg
Adidas Men's Adivat M Running Shoes,"₹1,259",['Dual tone light weight mesh & synthetic with recycled fibers with unique performance properties such as soft mesh with superior moisture and high durability. ;Midsole: lightstrike IMEVA midsole with visible adiprene providing protection from harmful impact forces ;Unique design of counters & deco stitch on the vamp which makes the shoe stand out. ;Upper: Mesh upper for lightweight and breathability'],"2,541 ratings",4.0 out of 5 stars,https://m.media-amazon.com/images/I/41fZ4wcGi-L._SX395_SY395_.jpg
Nike Men Air Zoom Vomero 16 Low Top Running Shoes,"₹9,312",['NIKE AIR ZOOM VOMERO 16-BLACK/WHITE-SUNDIAL-HIGH VOLTAGE-DA7245-012-9UK'],359 ratings,4.0 out of 5 stars,https://m.media-amazon.com/images/I/31xq4KkzmwL._SX395_SY395_.jpg
Adidas Breaknet 2.0 Men Casual Sneakers,"₹3,599","['UPPER MATERIAL - Synthetic', 'SOLE MATERIAL - Rubber', 'FASTENING - Lace-up', 'TOE SHAPE - Round', 'Color - Black']",618 ratings,4.1 out of 5 stars,https://m.media-amazon.com/images/I/31UH40wy+HL._SY395_SX395_.jpg
Nike Mens Jordan 1 Retro HighSneaker,"₹11,807","['Outer Material : Leather', 'All nike products are meant to deliver high performance, durability and great comfort', 'Warranty details: Contact seller for warranty']",67 ratings,2.9 out of 5 stars,https://m.media-amazon.com/images/I/41+Iv14MSwL._SX395_SY395_.jpg
Saucony Mens Endorphin Pro 4Running Shoe,"₹20,392","['Upgraded dual-cushioning system', 'Lattice designed outsole', 'Improved race-ready upper', 'New sockliner']",6 ratings,4.0 out of 5 stars,https://m.media-amazon.com/images/I/51K-j2FYiOL._SX395_SY395_QL70_ML2_.jpg
Puma Mens VoltigeSneaker,"₹2,699","['Style Name:-Sneaker', 'Model Name:-Voltige', 'Brand Color:-Shadow Gray-Black-Concrete Gray', 'Material:-Synthetic', 'Care Instructions:-Wipe with a clean dry cloth']",7 ratings,4.1 out of 5 stars,https://m.media-amazon.com/images/I/31SLQnjOF-L._SY395_SX395_.jpg
Puma Mens Contempt Demi Remix MeshRunning Shoe,"₹2,879","['Style Name:-Running Shoe', 'Model Name:-Contempt Demi Remix Mesh', 'Brand Color:-Black-Gold-Gum', 'Material:-Textile', 'Care Instructions:-Wipe with a clean dry cloth']",2 ratings,5.0 out of 5 stars,https://m.media-amazon.com/images/I/31EtfyofXvL._SY395_SX395_.jpg
Nike Mens Air Zoom Structure 25Running Shoes,"₹9,634",['NIKE AIR ZOOM STRUCTURE 25-GEODE TEAL/PURPLE INK-DEEP JUNGLE-WHITE-DJ7883-300-10UK'],2 ratings,4.0 out of 5 stars,https://m.media-amazon.com/images/I/31O6CB8IVWL._SY395_SX395_.jpg
Nike Mens Mens Air Zoom Pegasus 40 PrmRunning Shoes,"₹9,183",['AIR ZOOM PEGASUS 40-WHITE/OBSIDIAN-LT OREWOOD BRN-PHANTOM-DV3853-100-8UK'],144 ratings,4.0 out of 5 stars,https://m.media-amazon.com/images/I/31Al8P-bf+L._SY395_SX395_.jpg
Lancer Men's Sports Running Shoes Indus-251,₹549,"['Outer Material: Textile', 'Closure Type: Lace-Up', 'Toe Style: Round Toe', 'Warranty Type: Manufacturer', 'Warranty Description: 15 days']","4,614 ratings",3.7 out of 5 stars,https://m.media-amazon.com/images/I/41+xHhoHXML._SY395_SX395_.jpg
Skechers Boys Equalizer 3.0 Sneakers,"₹2,899","['Material Type: Mesh', 'Lifestyle: Casual', 'Closure Type: Lace-Up', 'Warranty Type: Manufacturer', 'Product warranty against manufacturing defects: 90 days', 'Care Instructions: Allow your pair of shoes to air and de-odorize at regular basis; use shoe bags to prevent any stains or mildew; dust any dry dirt from the surface using a clean cloth; do not use polish or shiner']","4,652 ratings",4.4 out of 5 stars,https://m.media-amazon.com/images/I/41ZY0PRpEoL._SX395_SY395_.jpg
SPARX Mens Sm 648sports Running Shoes,₹769,"['Light Weight', 'Breathable', 'Flexible']","6,301 ratings",4.1 out of 5 stars,https://m.media-amazon.com/images/I/41hf2ALTBtL._SX395_SY395_.jpg
Sparx Mens Sd0439gCasual Shoe,₹594,"['Outer Material: Canvas', 'Closure Type: Lace-Up', 'Toe Style: Round Toe', 'Warranty Type: Manufacturer', 'Warranty Description: 30 days']","13,612 ratings",4.2 out of 5 stars,https://m.media-amazon.com/images/I/31x8oyJlKOL._SX395_SY395_.jpg
ASICS Men's Gel-Rocket 11 Indoor Sports Shoes,"₹5,855","['Multi-purpose indoor court shoe that offers good stability and easy movement for a range of court athletes.', 'Provides better stability during game', 'Upper Material - Synthetic Leather']",52 ratings,3.9 out of 5 stars,https://m.media-amazon.com/images/I/41stg57LjtL._SX395_SY395_.jpg
Woodland Mens OGC 3497119Sneaker,"₹2,634",['MENS CASUALS LACES'],441 ratings,3.9 out of 5 stars,https://m.media-amazon.com/images/I/41D76ovPuqL._SX395_SY395_.jpg
Skechers Mens Crossbar-stilholtSports Shoe,"₹3,299","['RELAXED FIT Lace-Up Outdoor Shoe W/ Air-Cooled Memory Foam', 'MEDIUM CUSHIONING']",632 ratings,3.9 out of 5 stars,https://m.media-amazon.com/images/I/41aR9EAc64L._SX395_SY395_.jpg
